{
  "hu_id": "HU-001",
  "suites": [
    {
      "ts_id": "TS-01",
      "nombre": "Suite de Flujos Positivos - Autenticación",
      "descripcion": "Valida flujos exitosos de login, visualización de bienvenida y cierre de sesión",
      "tecnica_istqb": "Partición de Equivalencia, Análisis Causa-Efecto",
      "framework_sugerido": "Playwright",
      "prioridad": "Alta",
      "categoria": "Funcional"
    },
    {
      "ts_id": "TS-02",
      "nombre": "Suite de Flujos Negativos - Validaciones",
      "descripcion": "Valida rechazos, mensajes de error, validaciones de campos y límites de seguridad",
      "tecnica_istqb": "Valores Límite, Partición de Equivalencia",
      "framework_sugerido": "Playwright",
      "prioridad": "Alta",
      "categoria": "Funcional - Negativa"
    },
    {
      "ts_id": "TS-03",
      "nombre": "Suite de Seguridad - OWASP",
      "descripcion": "Valida controles anti-enumeración, anti-fuerza-bruta, auditoría, criptografía y gestión de tokens",
      "tecnica_istqb": "Análisis de Riesgos OWASP",
      "framework_sugerido": "Playwright + Newman + ZAP",
      "prioridad": "Crítica",
      "categoria": "Seguridad - OWASP"
    }
  ],
  "precondiciones": [
    {
      "prc_id": "PRC-01",
      "titulo": "Usuario válido registrado en BD",
      "descripcion": "Usuario 'juan.perez' con contraseña hasheada 'Pass123!' existe en tabla usuarios",
      "pasos_setup": [
        "Ejecutar script SQL: INSERT INTO usuarios (username, password_hash, nombre_completo, activo) VALUES ('juan.perez', '$2b$10$hashedPass123', 'Juan Pérez', true)",
        "Verificar registro en BD con query: SELECT * FROM usuarios WHERE username='juan.perez'"
      ],
      "datos_requeridos": "username='juan.perez', password='Pass123!' (texto plano para pruebas), nombre='Juan Pérez', activo=true",
      "estado_sistema": "BD usuarios contiene registro activo; tabla sesiones_activas vacía para ese usuario",
      "categoria": "Datos de Prueba",
      "reutilizable": true
    },
    {
      "prc_id": "PRC-02",
      "titulo": "Usuario con 2 intentos fallidos previos",
      "descripcion": "Usuario con contador de intentos=2 en ventana de 15 min para validar frontera de bloqueo",
      "pasos_setup": [
        "Crear usuario 'maria.lopez' usando PRC_1",
        "Ejecutar 2 intentos de login fallidos con credenciales incorrectas desde IP 192.168.1.100",
        "Verificar tabla intentos_login: contador=2, ip='192.168.1.100', timestamp dentro de últimos 15 min"
      ],
      "datos_requeridos": "username='maria.lopez', password='Pass456!', IP_origen='192.168.1.100', intentos_previos=2, timestamp_ultimo_intento=now()",
      "estado_sistema": "Contador de intentos fallidos = 2; ventana temporal activa; cuenta NO bloqueada",
      "categoria": "Datos de Prueba",
      "reutilizable": false
    },
    {
      "prc_id": "PRC-03",
      "titulo": "Sesión activa con token válido",
      "descripcion": "Usuario autenticado con token UUID v4 activo en tabla sesiones_activas",
      "pasos_setup": [
        "Ejecutar login exitoso para usuario 'juan.perez' (PRC_1)",
        "Capturar token generado de cookie o response header",
        "Verificar en BD: SELECT * FROM sesiones_activas WHERE usuario='juan.perez' AND token_valido=true"
      ],
      "datos_requeridos": "usuario='juan.perez', token=UUID v4 generado, timestamp_creacion=now(), timestamp_expiracion=now()+30min",
      "estado_sistema": "Token activo en sesiones_activas; cookie de sesión presente en navegador; usuario en página de bienvenida",
      "categoria": "Estado de Sistema",
      "reutilizable": true
    },
    {
      "prc_id": "PRC-04",
      "titulo": "Token de sesión expirado (30 min inactividad)",
      "descripcion": "Token generado hace exactamente 30 min sin actividad del usuario",
      "pasos_setup": [
        "Crear sesión para usuario 'pedro.garcia' (similar a PRC_3)",
        "Ejecutar UPDATE sesiones_activas SET timestamp_ultima_actividad = now() - interval '30 minutes' WHERE usuario='pedro.garcia'",
        "Verificar diferencia temporal: SELECT EXTRACT(EPOCH FROM (now() - timestamp_ultima_actividad))/60 AS minutos FROM sesiones_activas WHERE usuario='pedro.garcia'"
      ],
      "datos_requeridos": "usuario='pedro.garcia', token=UUID v4, timestamp_ultima_actividad=now()-30min, estado_token='pendiente_validacion'",
      "estado_sistema": "Token técnicamente presente en BD pero fuera de ventana de validez (30 min); usuario inactivo",
      "categoria": "Datos de Prueba",
      "reutilizable": false
    },
    {
      "prc_id": "PRC-05",
      "titulo": "Log de auditoría vacío y accesible",
      "descripcion": "Tabla audit_log limpia y lista para registrar eventos de autenticación",
      "pasos_setup": [
        "Limpiar tabla audit_log: DELETE FROM audit_log WHERE evento_tipo='LOGIN' AND timestamp > now() - interval '1 hour'",
        "Verificar permisos de escritura: INSERT INTO audit_log (evento_tipo, timestamp) VALUES ('TEST', now())",
        "Eliminar registro de prueba: DELETE FROM audit_log WHERE evento_tipo='TEST'"
      ],
      "datos_requeridos": "tabla audit_log con campos: id, timestamp, usuario, ip_origen, evento_tipo, resultado, detalles",
      "estado_sistema": "Tabla audit_log operativa sin registros del último ciclo de pruebas; índices creados en campos timestamp y usuario",
      "categoria": "Estado de Sistema",
      "reutilizable": true
    }
  ],
  "test_cases": [
    {
      "tc_id": "TC-01",
      "ts_id": "TS-01",
      "titulo": "Validar login exitoso con credenciales válidas",
      "tipo_prueba": "Funcional",
      "escenario_id": "E1",
      "brs_cubiertas": [
        "BR1",
        "BR3"
      ],
      "prcs_asociadas": [
        "PRC-01"
      ],
      "tecnica": "Partición de Equivalencia (clase válida)",
      "origen": "gap_sugerido",
      "es_smoke": true,
      "prioridad": "Crítica",
      "complejidad": "Baja",
      "tiempo_estimado": "15 min",
      "datos_entrada": "username='juan.perez', password='Pass123!'",
      "resultado_esperado": "Autenticación exitosa, token UUID v4 generado, redirección a /bienvenida con mensaje 'Bienvenido, Juan Pérez' y botón 'Cerrar sesión' visible",
      "pasos": [
        {
          "numero": 1,
          "accion": "Navegar a página de login e ingresar credenciales válidas",
          "datos": "URL='/login', campo_usuario='juan.perez', campo_password='Pass123!', botón='Iniciar sesión'",
          "resultado_esperado": "Sistema redirige a /bienvenida; mensaje 'Bienvenido, Juan Pérez'; botón 'Cerrar sesión' en esquina superior derecha; cookie de sesión presente con token UUID v4"
        }
      ],
      "vcr_propuesto": {
        "valor": 3,
        "costo": 1,
        "probabilidad": 3,
        "impacto": 3,
        "justificacion": "Valor=3 (flujo crítico de negocio); Costo=1 (prueba simple de 1 paso); Probabilidad=3 (alta probabilidad de regresión); Impacto=3 (fallo bloquea acceso total al sistema)"
      }
    },
    {
      "tc_id": "TC-02",
      "ts_id": "TS-01",
      "titulo": "Validar visualización de página de bienvenida con elementos post-login",
      "tipo_prueba": "Funcional",
      "escenario_id": "E5",
      "brs_cubiertas": [
        "BR3"
      ],
      "prcs_asociadas": [
        "PRC-03"
      ],
      "tecnica": "Partición de Equivalencia",
      "origen": "gap_sugerido",
      "es_smoke": false,
      "prioridad": "Alta",
      "complejidad": "Baja",
      "tiempo_estimado": "12 min",
      "datos_entrada": "sesión_activa=true, usuario='juan.perez', token=UUID v4 válido",
      "resultado_esperado": "Mensaje 'Bienvenido, Juan Pérez', botón 'Cerrar sesión' en esquina superior derecha, cookie de sesión activa",
      "pasos": [
        {
          "numero": 1,
          "accion": "Cargar página /bienvenida con sesión activa",
          "datos": "URL='/bienvenida', cookie_sesion=token_UUID_v4",
          "resultado_esperado": "Mensaje 'Bienvenido, Juan Pérez' visible; botón 'Cerrar sesión' en posición top-right con clases CSS específicas; token presente en cookies del navegador; timestamp_ultima_actividad actualizado en BD"
        }
      ],
      "vcr_propuesto": {
        "valor": 2,
        "costo": 1,
        "probabilidad": 2,
        "impacto": 2,
        "justificacion": "Valor=2 (confirmación visual importante); Costo=1 (prueba simple); Probabilidad=2 (cambios en UI moderados); Impacto=2 (fallo afecta UX pero no seguridad)"
      }
    },
    {
      "tc_id": "TC-03",
      "ts_id": "TS-01",
      "titulo": "Validar cierre de sesión con invalidación de token",
      "tipo_prueba": "Funcional",
      "escenario_id": "E6",
      "brs_cubiertas": [
        "BR3",
        "BR7"
      ],
      "prcs_asociadas": [
        "PRC-03"
      ],
      "tecnica": "Análisis Causa-Efecto",
      "origen": "gap_sugerido",
      "es_smoke": false,
      "prioridad": "Alta",
      "complejidad": "Media",
      "tiempo_estimado": "18 min",
      "datos_entrada": "sesión_activa=true, usuario='juan.perez', botón='Cerrar sesión'",
      "resultado_esperado": "Token invalidado en BD y cookies eliminadas, redirección a /login",
      "pasos": [
        {
          "numero": 1,
          "accion": "Hacer clic en botón Cerrar sesión",
          "datos": "URL_actual='/bienvenida', botón='Cerrar sesión'",
          "resultado_esperado": "Sistema ejecuta logout; token marcado como inválido en tabla sesiones_activas; cookie de sesión eliminada del navegador"
        },
        {
          "numero": 2,
          "accion": "Verificar redirección y estado del sistema",
          "datos": "URL_esperada='/login'",